<?xml version="1.0" ?>
<!--- PLML extended version BO-2.0 from https://github.com/bogeo/suspatterns/plml/plml_bo-2.0.xsd. --> 
<xsd:schema xmlns:xsd="http://www.w3.org/2001/XMLSchema">
	<xsd:element name="pattern">
		<xsd:complexType>
			<xsd:sequence>
				<xsd:element maxOccurs="1" minOccurs="1" name="name" type="xsd:string"/>
				<xsd:element maxOccurs="unbounded" minOccurs="0" name="alias" type="xsd:string"/>
				<xsd:element maxOccurs="1" minOccurs="0" name="illustration"/>
				<xsd:element maxOccurs="1" minOccurs="1" name="problem" type="xsd:string"/>
				<xsd:element maxOccurs="1" minOccurs="0" name="context" type="xsd:string"/>
				<xsd:element maxOccurs="1" minOccurs="0" name="forces"/>
				<xsd:element maxOccurs="1" minOccurs="1" name="solution"/>
				<xsd:element maxOccurs="1" minOccurs="0" name="synopsis" type="xsd:string"/>
				<xsd:element maxOccurs="1" minOccurs="0" name="diagram">
					<xsd:complexType>
						<xsd:simpleContent>
							<xsd:extension base="xsd:string">
								<xsd:attribute name="location" type="xsd:string" use="required"/>
							</xsd:extension>
						</xsd:simpleContent>
					</xsd:complexType>
				</xsd:element>
				<xsd:element maxOccurs="1" minOccurs="0" name="evidence">
					<xsd:complexType>
						<xsd:sequence>
							<xsd:element maxOccurs="unbounded" minOccurs="0" name="example"/>
							<xsd:element maxOccurs="1" minOccurs="0" name="rationale"/>
						</xsd:sequence>
					</xsd:complexType>
				</xsd:element>
				<xsd:element maxOccurs="1" minOccurs="0" name="confidence" type="xsd:string"/>
				<xsd:element maxOccurs="1" minOccurs="0" name="literature">
					<xsd:annotation>
						<xsd:documentation>Opposite to PLML 1.1, literature will be given separate ref elements here</xsd:documentation>
					</xsd:annotation>
					<xsd:complexType>
						<xsd:sequence>
							<xsd:element maxOccurs="unbounded" minOccurs="0" name="ref">
								<xsd:complexType>
									<xsd:simpleContent>
										<xsd:extension base="xsd:string">
											<xsd:attribute name="id" type="xsd:string" use="optional"/>
										</xsd:extension>
									</xsd:simpleContent>
								</xsd:complexType>
							</xsd:element>
						</xsd:sequence>
					</xsd:complexType>
				</xsd:element>
				<xsd:element maxOccurs="1" minOccurs="0" name="implementation"/>
				<xsd:element maxOccurs="1" minOccurs="0" name="formalization">
					<xsd:complexType>
						<xsd:sequence>
							<xsd:element maxOccurs="unbounded" minOccurs="0" name="participant">
								<xsd:annotation>
									<xsd:documentation>Optional listing of pattern participants</xsd:documentation>
								</xsd:annotation>
								<xsd:complexType>
									<xsd:simpleContent>
										<xsd:extension base="xsd:string">
											<xsd:attribute name="identifier" type="xsd:string" use="required"/>
											<xsd:attribute name="type" type="xsd:string" use="required"/>
										</xsd:extension>
									</xsd:simpleContent>
								</xsd:complexType>
							</xsd:element>
							<xsd:element maxOccurs="unbounded" minOccurs="0" name="source-code">
								<xsd:complexType>
									<xsd:simpleContent>
										<xsd:extension base="xsd:string">
											<xsd:attribute name="location" type="xsd:string" use="required"/>
										</xsd:extension>
									</xsd:simpleContent>
								</xsd:complexType>
							</xsd:element>
						</xsd:sequence>
						<xsd:attribute name="language" type="xsd:string" use="required"/>
					</xsd:complexType>
				</xsd:element>
				<xsd:element maxOccurs="1" minOccurs="0" name="related-patterns">
					<xsd:complexType>
						<xsd:sequence>
							<xsd:element maxOccurs="unbounded" minOccurs="0" name="pattern-link">
								<xsd:annotation>
									<xsd:documentation>Pre-defined PLML relation type</xsd:documentation>
								</xsd:annotation>
								<xsd:complexType>
									<xsd:simpleContent>
										<xsd:extension base="xsd:string">
											<xsd:attribute name="type" type="xsd:string" use="required"/>
											<xsd:attribute name="patternID" type="xsd:integer" use="required"/>
											<xsd:attribute name="collection" type="xsd:string" use="required"/>
											<xsd:attribute name="label" type="xsd:string" use="required"/>
										</xsd:extension>
									</xsd:simpleContent>
								</xsd:complexType>
							</xsd:element>
						</xsd:sequence>
					</xsd:complexType>
				</xsd:element>
				<xsd:element maxOccurs="1" minOccurs="0" name="management">
					<xsd:complexType>
						<xsd:sequence>
							<xsd:element maxOccurs="1" minOccurs="0" name="author" type="xsd:string"/>
							<xsd:element maxOccurs="1" minOccurs="0" name="revision-number" type="xsd:string"/>
							<xsd:element maxOccurs="1" minOccurs="0" name="creation-date" type="xsd:string"/>
							<xsd:element maxOccurs="1" minOccurs="0" name="last-modified" type="xsd:string"/>
							<xsd:element maxOccurs="1" minOccurs="0" name="credits" type="xsd:string"/>
						</xsd:sequence>
					</xsd:complexType>
				</xsd:element>
			</xsd:sequence>
			<xsd:attribute name="patternID" type="xsd:integer"/>
			<xsd:attribute name="collection" type="xsd:string"/>
		</xsd:complexType>
	</xsd:element>
</xsd:schema>
