<?xml version="1.0" ?>
<?xml-stylesheet href="../plml/plml_bo-2.0.css"?>
<pattern patternID="8" collection="candidates" 
		xsi:noNamespaceSchemaLocation="../plml/plml_bo-2.0.xsd" 
		xmlns:xsi="http://www.w3.org/2001/XMLSchema-instance">
	<name>Open Source</name>
	<alias>Repair</alias>
	<problem>
		A software lacks functionality or can not be used anymore since the 
		technical environment changed or since there simply is a bug in it which
		the software producer will not fix.
	</problem>
	<solution>
		Make available the source code to enable the user to extend or repair the 
		software. This requires that the user has the technical skills and know-how 
		to change the software as well as a suitable build environment.
	</solution>
	<evidence>
		<rationale>
			Implementation of this "pattern" might raise sustainability awareness 
			(see related pattern candidate). Thus, this pattern seems to refer to 
			the concept of "strong sustainability" (Martens & Schilder 2013), but
			this remains to be discussed in further detail: How and to which extent
			does the Open Source philosophy contribute to the goals of sustainable
			development? (And: Is it really a "pattern"?)
		</rationale>
	</evidence>
	<confidence>Idea</confidence>
	<literature>
		<bibliomixed id="1">
			Busch, T. (2008): Open Source und Nachhaltigkeit. Open Source Jahrbuch 
			2008, TU Berlin.
		</bibliomixed>
	</literature>
	<formalization language="CafeOBJ">
  		<participant identifier="user" type="User &lt; uml$Actor"/>
		<participant identifier="env" type="BuildEnv"/>	
		<participant identifier="code" type="uml$Source"/>	
		<participant identifier="softw" type="uml$Executable"/>	
  		<source-code location="OpenSource.cafe"/>
	</formalization>
	<related-patterns>
		<pattern-link type="is-contained-by" 
			patternID="99" collection="candidates" 
			label="raise sustainability awareness"/>
	</related-patterns>
	<management>
		<author>Benno Schmidt</author>
		<revision-number>0.4</revision-number>
		<creation-date>14.07.2019</creation-date>
		<last-modified>12.06.2021</last-modified>
	</management>
</pattern>
